{
  "schemaVersion": "jstack.organization.directory.v1",
  "directoryVersion": "1.0.0",
  "capabilityCatalog": {
    "schemaVersion": "jstack.capability.catalog.v1",
    "catalogVersion": "1.1.0",
    "catalogDigest": "65bea701e5a7eced1c33fdd4253fee23b0c1f0ac9d97ece4f24e85ee933c4c28"
  },
  "sourceProvenance": [
    {
      "id": "gstack-research-baseline",
      "sourceType": "external-research",
      "sourceReference": "https://github.com/garrytan/gstack.git@ad8400543cd9ce8d07641362db48d44a95417e33",
      "sourceDigest": "a393523ca34dfdeb3517a3a46f18b2b5d167172c37cdfa14266e2ded1be18f65",
      "license": "MIT",
      "adaptationClass": "ADAPTED",
      "copiedPromptContent": false
    },
    {
      "id": "unified-os-specification",
      "sourceType": "jstack-specification",
      "sourceReference": "JSTACK_GSTACK_UNIFIED_ENGINEERING_OS_SPEC.md",
      "sourceDigest": "00e47070f78be1d10488ff89d001152fcd5827ddcd4718a1cd0d163625a33a2a",
      "license": "project-authoritative-input",
      "adaptationClass": "NATIVE",
      "copiedPromptContent": false
    }
  ],
  "departments": [
    {
      "id": "audit-assurance",
      "displayName": "Audit & Assurance",
      "purpose": "Provide independent read-only assurance across correctness, security, architecture, operations, and release.",
      "specialistIds": [
        "audit-lead",
        "correctness-auditor",
        "release-auditor",
        "security-auditor"
      ],
      "selectionPolicy": "dynamic-material-need",
      "authorityEffect": "none",
      "physicalAgentEffect": "none"
    },
    {
      "id": "design",
      "displayName": "Design",
      "purpose": "Define coherent product experience, systems, motion, and accessibility without creating implementation authority.",
      "specialistIds": [
        "accessibility-specialist",
        "design-lead",
        "design-systems-engineer",
        "motion-designer",
        "product-designer"
      ],
      "selectionPolicy": "dynamic-material-need",
      "authorityEffect": "none",
      "physicalAgentEffect": "none"
    },
    {
      "id": "domain",
      "displayName": "Domain Specialists",
      "purpose": "Provide financial, quantitative, and data-domain review where generic engineering expertise is insufficient.",
      "specialistIds": [
        "data-specialist",
        "financial-systems-reviewer",
        "quant-engineer"
      ],
      "selectionPolicy": "dynamic-material-need",
      "authorityEffect": "none",
      "physicalAgentEffect": "none"
    },
    {
      "id": "engineering",
      "displayName": "Engineering",
      "purpose": "Own architecture and bounded implementation through existing JStack role authority.",
      "specialistIds": [
        "api-platform-engineer",
        "backend-engineer",
        "database-engineer",
        "frontend-engineer",
        "infrastructure-engineer",
        "lead-engineer",
        "software-architect"
      ],
      "selectionPolicy": "dynamic-material-need",
      "authorityEffect": "none",
      "physicalAgentEffect": "none"
    },
    {
      "id": "investigation-reliability",
      "displayName": "Investigation & Reliability",
      "purpose": "Trace behavior, reproduce defects, falsify hypotheses, and identify root causes before remediation.",
      "specialistIds": [
        "production-debugger",
        "reliability-engineer",
        "root-cause-investigator"
      ],
      "selectionPolicy": "dynamic-material-need",
      "authorityEffect": "none",
      "physicalAgentEffect": "none"
    },
    {
      "id": "product",
      "displayName": "Product",
      "purpose": "Clarify product outcomes, scope, user value, and developer experience.",
      "specialistIds": [
        "developer-experience-lead",
        "documentation-handoff-writer",
        "product-strategist"
      ],
      "selectionPolicy": "dynamic-material-need",
      "authorityEffect": "none",
      "physicalAgentEffect": "none"
    },
    {
      "id": "quality",
      "displayName": "Quality",
      "purpose": "Design and execute independent verification without gaining remediation authority.",
      "specialistIds": [
        "browser-qa-engineer",
        "qa-engineer",
        "qa-lead",
        "regression-engineer"
      ],
      "selectionPolicy": "dynamic-material-need",
      "authorityEffect": "none",
      "physicalAgentEffect": "none"
    },
    {
      "id": "release-operations",
      "displayName": "Release & Operations",
      "purpose": "Assess delivery, rollback, monitoring, and release readiness without authorizing external action.",
      "specialistIds": [
        "devops-engineer",
        "release-engineer"
      ],
      "selectionPolicy": "dynamic-material-need",
      "authorityEffect": "none",
      "physicalAgentEffect": "none"
    },
    {
      "id": "security",
      "displayName": "Security",
      "purpose": "Apply security, identity, AI-code, and supply-chain assurance independently from builders.",
      "specialistIds": [
        "application-security-engineer",
        "chief-security-officer",
        "identity-access-engineer",
        "supply-chain-security-engineer"
      ],
      "selectionPolicy": "dynamic-material-need",
      "authorityEffect": "none",
      "physicalAgentEffect": "none"
    }
  ],
  "specialists": [
    {
      "id": "accessibility-specialist",
      "displayName": "Accessibility Specialist",
      "description": "Reviews inclusive interaction, keyboard, focus, semantic, and reduced-motion behavior.",
      "departmentId": "design",
      "canonicalRoleId": "qa",
      "capabilityIds": ["accessibility-assurance", "evidence-led-handoff"],
      "activation": {
        "domains": ["accessibility", "product-ui"],
        "classifications": ["ui_product"],
        "changedSurfaces": ["frontend", "mobile", "native-ui"],
        "taskSignals": ["accessibility", "keyboard", "screen reader", "reduced motion"]
      },
      "riskRequirements": {"mandatoryFor": [], "prohibitedFor": []},
      "independence": {"requiredFor": ["accessibility-audit"], "mustBeIndependentFromRoles": ["builder"]},
      "providerRequirementIds": [],
      "sourceProvenanceIds": ["gstack-research-baseline", "unified-os-specification"],
      "physicalAgentBinding": "composer-assigned",
      "authorityMode": "inherit-canonical-role",
      "permissionOverridesAllowed": false
    },
    {
      "id": "api-platform-engineer",
      "displayName": "API Platform Engineer",
      "description": "Implements bounded API contracts and platform integration within assigned write scope.",
      "departmentId": "engineering",
      "canonicalRoleId": "builder",
      "capabilityIds": ["api-platform", "evidence-led-handoff", "minimal-change"],
      "activation": {
        "domains": ["api", "backend", "platform"],
        "classifications": ["architecture", "normal"],
        "changedSurfaces": ["api", "backend"],
        "taskSignals": ["api", "endpoint", "integration", "webhook"]
      },
      "riskRequirements": {"mandatoryFor": [], "prohibitedFor": []},
      "independence": {"requiredFor": [], "mustBeIndependentFromRoles": []},
      "providerRequirementIds": [],
      "sourceProvenanceIds": ["gstack-research-baseline", "unified-os-specification"],
      "physicalAgentBinding": "composer-assigned",
      "authorityMode": "inherit-canonical-role",
      "permissionOverridesAllowed": false
    },
    {
      "id": "application-security-engineer",
      "displayName": "Application Security Engineer",
      "description": "Reviews application trust boundaries, abuse paths, secrets, and exploitability.",
      "departmentId": "security",
      "canonicalRoleId": "security",
      "capabilityIds": ["ai-code-security", "compliance-assurance", "evidence-led-handoff", "identity-access"],
      "activation": {
        "domains": ["application-security", "security"],
        "classifications": ["production_release", "security_compliance"],
        "changedSurfaces": ["auth", "public-boundary", "security"],
        "taskSignals": ["auth", "public endpoint", "secret", "security"]
      },
      "riskRequirements": {"mandatoryFor": ["high", "production"], "prohibitedFor": []},
      "independence": {"requiredFor": ["high-risk-security-review"], "mustBeIndependentFromRoles": ["builder"]},
      "providerRequirementIds": [],
      "sourceProvenanceIds": ["gstack-research-baseline", "unified-os-specification"],
      "physicalAgentBinding": "composer-assigned",
      "authorityMode": "inherit-canonical-role",
      "permissionOverridesAllowed": false
    },
    {
      "id": "audit-lead",
      "displayName": "Audit Lead",
      "description": "Coordinates independent read-only assurance and reconciles audit evidence.",
      "departmentId": "audit-assurance",
      "canonicalRoleId": "reviewer",
      "capabilityIds": ["codebase-orientation", "compliance-assurance", "evidence-led-handoff", "workflow-architecture"],
      "activation": {
        "domains": ["assurance", "audit"],
        "classifications": ["architecture", "production_release", "security_compliance"],
        "changedSurfaces": ["audit-scope"],
        "taskSignals": ["audit", "assurance", "release review"]
      },
      "riskRequirements": {"mandatoryFor": [], "prohibitedFor": []},
      "independence": {"requiredFor": ["audit"], "mustBeIndependentFromRoles": ["builder"]},
      "providerRequirementIds": [],
      "sourceProvenanceIds": ["gstack-research-baseline", "unified-os-specification"],
      "physicalAgentBinding": "composer-assigned",
      "authorityMode": "inherit-canonical-role",
      "permissionOverridesAllowed": false
    },
    {
      "id": "backend-engineer",
      "displayName": "Backend Engineer",
      "description": "Implements bounded server, persistence, and service changes.",
      "departmentId": "engineering",
      "canonicalRoleId": "builder",
      "capabilityIds": ["api-platform", "database-reliability", "evidence-led-handoff", "minimal-change"],